{
  "project_id": "wt6i-jira",
  "name": "WT6I Jira mock project",
  "workspace_root": ".",
  "runs_root": ".agent-runs",
  "connections": {
    "github": {
      "credential-ref": "env:WT6I_GITHUB_PR_TOKEN"
    },
    "work-tracker": {
      "provider": "jira",
      "credential-ref": "env:WT6I_JIRA_TRACKER_TOKEN",
      "config": {
        "base-url": "https://jira.example.invalid",
        "project-key": "WT6I"
      }
    }
  }
}
